Título,Fecha,Contenido,Etiquetas,Número de Comentarios,Enlace
UNE prevé afectación de 1 365 MW en pico nocturno este sábado,2025-02-08 09:22:00,"Foto: Archivo. El Sistema Eléctrico Nacional (SEN) de Cuba enfrentó una situación compleja durante las últimas 24 horas, con interrupciones que se extendieron hasta la madrugada de este 8 de febrero. La máxima afectación registrada alcanzó los 1 731 megawatts (MW) a las 6:50 p.m., coincidiendo con el momento de mayor demanda energética en el país. A las 7:00 a.m. de este sábado, la disponibilidad del SEN se situó en 1 590 MW, mientras que la demanda ascendió a 2 250 MW, lo que generó un déficit de 650 MW. Para el mediodía, se estima que la afectación aumentará a 950 MW. Entre las principales incidencias que han contribuido a este escenario se encuentran averías en unidades clave de centrales termoeléctricas. La Unidad 3 de la CTE Santa Cruz, la Unidad de la CTE Guiteras —que se encuentra en proceso de arranque— y la Unidad 2 de la CTE Felton están fuera de servicio. Además, varias unidades están sometidas a mantenimiento, como la Unidad 2 de la CTE Santa Cruz, las Unidades 3 y 4 de la CTE Cienfuegos y la Unidad 5 de la CTE Renté. A esto se suman limitaciones térmicas que han dejado fuera de servicio 325 MW. Otro factor que ha impactado negativamente es la falta de combustible, que ha afectado a 56 centrales de generación distribuida, con una capacidad total de 411 MW. Se espera la recuperación de 100 MW en motores de generación distribuida que estaban fuera de servicio por falta de combustible. Además, se prevé la entrada en operación de 4 motores de la móvil de Melones, con una capacidad de 65 MW, y la Unidad de la CTE Guiteras, que aportaría 250 MW y actualmente se encuentra en proceso de arranque. Con estas previsiones, se estima que la disponibilidad del SEN alcance los 2 005 MW, mientras que la demanda máxima podría llegar a 3 300 MW. Esto generaría un déficit de 1 295 MW, y de mantenerse las condiciones actuales, la afectación podría aumentar a 1 365 MW. (Con información de la UNE-MINEM)","Apagón, Apagones, Cuba, Economía, Electricidad, Gobierno, Ministerio de Energía y Minas (MINEM), Unión Eléctrica (UNE)",20,http://www.cubadebate.cu/noticias/2025/02/08/une-preve-afectacion-de-1-365-mw-en-pico-nocturno-este-sabado/
La UNE pronostica una afectación de 1 575 MW para el horario pico de este jueves,2025-02-06 09:45:00,"Foto: Archivo/Cubadebate. La Unión Eléctrica de Cuba informó que en el día de ayer el servicio eléctrico estuvo afectado durante las 24 horas y se mantuvo interrumpido durante la madrugada de hoy. La máxima afectación registrada fue de 1 696 MW a las 6:30 p.m., coincidiendo con la hora de máxima demanda. A las 7:00 a.m., la disponibilidad del SEN es de 1 465 MW, mientras que la demanda alcanza los 2 350 MW, lo que provoca una afectación de 955 MW. Para el mediodía, se estima una afectación de 1350 MW. Entre las principales incidencias, la UNE señaló averías en la Unidad 5 de la CTE Mariel, la Unidad de la CTE Guiteras, la Unidad 5 de la CTE Nuevitas y la Unidad 2 de la CTE Felton. Se encuentran en mantenimiento la Unidad 2 de la CTE Santa Cruz, las Unidades 3 y 4 de la CTE Cienfuegos, la Unidad 1 de la CTE Felton y la Unidad 5 de la CTE Renté. Las limitaciones térmicas se calculan 193 MW fuera de servicio. Se reportan problemas por falta de combustible 53 centrales de generación distribuida (279 MW). Para el horario pico de este jueves se espera la recuperación de 80 MW en motores de la generación distribuida, que están fuera por combustible. También se prevé la entrada de la Unidad 5 de la CTE Mariel (60 MW), mientras quela Unidad 5 de la CTE Nuevitas (70 MW) se encuentra en proceso de arranque. Con este pronóstico, se estima una disponibilidad de 1 675 MW y una demanda máxima de 3 180 MW, lo que generaría un déficit de 1 505 MW. De mantenerse estas condiciones, la afectación podría alcanzar los 1 575 MW. (Con información de la UNE)","Apagones, Combustibles, Cuba, Economía, Electricidad, Gobierno, Ministerio de Energía y Minas (MINEM), Unión Eléctrica (UNE)",8,http://www.cubadebate.cu/noticias/2025/02/06/la-une-pronostica-una-afectacion-de-1-575-mw-para-el-horario-pico-de-este-jueves/
Unión Eléctrica pronostica afectación de 1 630 MW durante pico nocturno,2025-02-05 09:39:00,"Foto: ACN. A las 7:00 a.m., la disponibilidad del SEN es de 1,470 MW, mientras que la demanda alcanza los 2,350 MW, lo que provoca una afectación de 911 MW. Para el mediodía, se estima una afectación de 1350 MW. Averías: Unidad 3 de la CTE Santa Cruz, Unidad de la CTE Guiteras, Unidad 5 de la CTE Nuevitas y Unidad 2 de la CTE Felton. Mantenimiento: Unidad 2 de la CTE Santa Cruz, Unidades 3 y 4 de la CTE Cienfuegos, Unidad 1 de la CTE Felton y Unidad 5 de la CTE Renté. Limitaciones térmicas: 160 MW fuera de servicio. Problemas por falta de combustible: 54 centrales de generación distribuida (342 MW). Se espera: Recuperación de 150 MW en motores de la generación distribuida con 342 MW afectados por esta causa. Entrada de: • Unidad 5 de la CTE Nuevitas (70 MW). Con este pronóstico, se estima una disponibilidad de 1,685 MW y una demanda máxima de 3,250 MW, lo que generaría un déficit de 1,560 MW. De mantenerse estas condiciones, la afectación podría alcanzar los 1,630 MW. Ayer, el servicio eléctrico estuvo afectado durante las 24 horas y se mantuvo interrumpido durante la madrugada de hoy. La máxima afectación registrada fue de 1,775 MW a las 6:40 p.m., coincidiendo con la hora de máxima demanda. (Con información de la UNE )","Combustibles, Cuba, Economía, Electricidad, Energía, Gobierno, Ministerio de Energía y Minas (MINEM), Sistema Eléctrico Nacional (SEN), Termoeléctrica, Unión Eléctrica (UNE)",45,http://www.cubadebate.cu/noticias/2025/02/05/union-electrica-pronostica-afectacion-de-1-630-mw-durante-pico-nocturno/
Unión Eléctrica pronostica déficit de 1545 MW para el horario pico nocturno de este lunes,2025-02-03 11:36:00,"La situación eléctrica continúa muy compleja. Foto: Archivo. Ayer, el servicio eléctrico estuvo afectado durante las 24 horas y se mantuvo interrumpido durante la madrugada de hoy. La máxima afectación registrada fue de 1,584 MW a las 6:50 p.m., coincidiendo con la hora de máxima demanda. Estado actual del SEN A las 7:00 a.m., la disponibilidad del SEN es de 1,710 MW, mientras que la demanda alcanza los 2,300 MW, lo que provoca una afectación de 609 MW. Para el mediodía, se estima una afectación de 980 MW. Principales incidencias: Averías: Unidad 1 de la CTE Santa Cruz, Unidad 5 de la CTE Nuevitas y Unidad 2 de la CTE Felton. Mantenimiento: Unidad 2 de la CTE Santa Cruz, Unidades 3 y 4 de la CTE Cienfuegos, Unidad 1 de la CTE Felton y Unidad 5 de la CTE Renté. Limitaciones térmicas: 265 MW fuera de servicio. Problemas por falta de combustible: 54 centrales de generación distribuida (284 MW). 5 motores de la Patana de Regla fuera de servicio (45 MW) Total afectado por combustible: 329 MW. Pronóstico para el horario pico Se espera la entrada de: 5 motores en la Patana de Regla (45 MW). Unidad 5 de la CTE Nuevitas (70 MW). Con este pronóstico, se estima una disponibilidad de 1,825 MW y una demanda máxima de 3,300 MW, lo que generaría un déficit de 1,475 MW. De mantenerse estas condiciones, la afectación podría alcanzar los 1,545 MW. (Con información de UNE-MINEM )","Apagón, Apagones, Economía, Electricidad, Empresa Eléctrica, Gobierno, Ministerio de Energía y Minas (MINEM), Sistema Eléctrico Nacional (SEN), Sociedad, Unión Eléctrica (UNE)",6,http://www.cubadebate.cu/noticias/2025/02/03/union-electrica-pronostica-deficit-de-1545-mw-para-el-horario-pico-nocturno-de-este-lunes/
"La Unión Eléctrica pronostica una afectación de 1,550 MW para la hora pico nocturno",2025-01-31 09:47:00,"Trabajadores de la Unión Eléctrica. Foto: Andy Jorge Blanco/Cubadebate. La Unión Eléctrica estima para la hora pico nocturna una disponibilidad de 1 740 MW. Con una demanda de 3 220 MW, por lo que, de mantenerse las condiciones previstas se pronostica una afectación de 1 550 MW. Se espera la entrada de 5 motores en la patana de Regla (49 MW). A las 04:16 a.m.de este jueves se reportan nuevas afectaciones por altas transferencias. La disponibilidad  del SEN a las 07:00 a.m. era de 1 691 MW, con una demanda de 2 100 MW, lo que provoca una afectación de 526 MW. En el horario del mediodía se prevé una afectación de 980 MW. Presentan  averías: Unidades en Santa Cruz, Renté y Felton. En mantenimiento: Unidades en Santa Cruz, Cienfuegos, Felton y Renté. Limitaciones térmicas: 222 MW fuera de servicio. Centrales fuera por combustible: 354 MW. En el día de ayer el servicio eléctrico fue afectado desde las 5:32 a.m. hasta las 2:28 a.m. de esta jornada, con una máxima afectación de 1 442 MW a las 6:50 p.m. en la zona centro-oriental. (Tomado de UNE-MINEM)","Apagones, Electricidad, Empresa Eléctrica, Gobierno, Ministerio de Energía y Minas (MINEM)",21,http://www.cubadebate.cu/noticias/2025/01/31/la-union-electrica-pronostica-una-afectacion-de-1550-mw-para-la-hora-pico-nocturno/
UNE pronostica afectación de 1 460 MW durante pico nocturno de este jueves,2025-01-30 08:51:00,"La central termoeléctrica Lidio Ramón (Felton). Foto: Juan Pablo Carreras Vidal/ ACN/ Archivo. La Unión Eléctrica estima para la hora pico nocturna de este jueves una disponibilidad de 1 830 MW y una demanda de 3 220 MW, por lo que pronostica que la afectación al servicio podría ascender a 1 460 MW. A las 7 a.m., la disponibilidad fue de 1 710 MW, con una demanda de 2 200 MW, lo que provocó una afectación de 397 MW. Para el mediodía, se prevé una afectación de 980 MW. Desde las 5:32 a.m. se reportaron nuevas afectaciones por altas transferencias. Para el horario pico se espera la entrada de Renté 6 (60 MW) y cuatro motores en Moa (60 MW). Presentan averías las unidades en Santa Cruz, Renté y Felton. Están en mantenimiento las unidades en Santa Cruz, Cienfuegos y Renté. La unidad 1 de Felton saldrá de servicio este jueves por 10 días. Las limitaciones térmicas son de 326 MW. Centrales fuera por combustible: 271 MW. Ayer, el servicio eléctrico fue afectado desde las 4:45 a.m. hasta las 11:48 p.m., con una máxima afectación de 1 435 MW a las 6:40 p.m. en la zona centro-oriental.","Cuba, Economía, Electricidad, Empresa Eléctrica, Generación Eléctrica, Gobierno, Ministerio de Energía y Minas (MINEM), Sistema Eléctrico Nacional (SEN), Termoeléctrica, Unión Eléctrica (UNE)",17,http://www.cubadebate.cu/noticias/2025/01/30/une-pronostica-afectacion-de-1-460-mw-durante-pico-nocturno-de-este-jueves/
Unión Eléctrica pronostica afectaciones de 1365 MW para el horario pico de este miércoles,2025-01-29 10:16:00,"En el día de ayer el servicio eléctrico fue afectado desde las 05:01 a.m., hasta las 01:34 a.m. de hoy, con una afectación máxima de 1,416 MW registrada a las 06:20 p.m., coincidiendo con la hora de máxima demanda y con mayor incidencia hacia la región centro-oriental. Para hoy a las 04:45 de la madrugada se reportaron nuevas afectaciones debido a altas transferencias hacia dicha región. A las 7:00 a.m., la disponibilidad del SEN es de 1,840 MW, frente a una demanda de 2,200 MW, con 581 MW afectados en la zona centro-oriental. Para el mediodía, se estima la afectación de 950 MW, también concentrados en esta región. Entre las principales afectaciones inciden las averías de las unidades 6 de la CTE Renté y 2 de la CTE Felton. En mantenimiento se encuentran la unidad 2 de la CTE Santa Cruz, Unidades 3 y 4 de la CTE Cienfuegos y Unidad 5 de la CTE Renté. En cuanto a las limitaciones térmicas están 359 MW fuera de servicio y por problemáticas por falta de combustible existen 52 centrales de generación distribuida con 283 MW y la central fuel de Moa con 126 MW, para un total de 409 MW afectados. Para el horario pico de este miércoles se espera la entrada de 6 motores de la central fuel de Moa con 85 MW, lo que llevaría la disponibilidad a 1,925 MW, frente a una demanda máxima de 3,220 MW, lo que implicaría un déficit de 1,295 MW. En consecuencia, se pronostica una afectación de 1,365 MW en el horario pico. (Con información de la UNE-MINEM)","Apagones, Combustibles, Economía, Electricidad, Empresa Eléctrica, Gobierno, Gobierno cubano, Ministerio de Energía y Minas (MINEM), Unión Eléctrica (UNE)",21,http://www.cubadebate.cu/noticias/2025/01/29/union-electrica-pronostica-afectaciones-de-1365-mw-para-el-horario-pico-de-este-miercoles/
La Unión Eléctrica pronostica una afectación de 1 440 MW para el pico nocturno de este martes,2025-01-28 09:06:00,"Foto: Archivo/Cubadebate. La Unión Eléctrica estima para el horario pico de este martes una afectación de 1 440 MW debido a un déficit de 1 370 MW. A las 5:01 a.m. se reportaron nuevas afectaciones por altas transferencias hacia la zona centro-oriental y a las 7:00 a.m., la disponibilidad del SEN era de 1 880 MW , frente a una demanda de 2 150 MW, con 502 MW afectados. En el día de ayer el servicio eléctrico fue afectado desde las 6:05 a.m. hasta las 1:32 a.m. de hoy , alcanzando una máxima afectación de 1 555 MW a las 6:50 p.m., con mayor incidencia en la región centro-oriental. Se encuentran con averías la unidad 5 de la CTE Nuevitas y unidad 2 de la CTE Felton. Además, están en mantenimiento las unidades en Santa Cruz, Cienfuegos y Renté. Las limitaciones de generación térmica son de 348 MW. (Con información de la UNE-MINEM)","Apagón, Apagones, Combustibles, Economía, Electricidad, Empresa Eléctrica, Gobierno, Ministerio de Energía y Minas (MINEM), Unión Eléctrica (UNE)",8,http://www.cubadebate.cu/noticias/2025/01/28/la-union-electrica-pronostica-una-afectacion-de-1-440-mw-para-el-pico-nocturno-de-este-martes/
Unión Eléctrica estima afectación de 1411 MW para el pico nocturno de este lunes,2025-01-27 09:11:00,"Trabajadores de la Unión Eléctrica. Foto: Andy Jorge Blanco/Cubadebate. Ayer el servicio eléctrico fue afectado desde las 6:51 a.m. hasta las 10:35 p.m., con una máxima afectación de 1,227 MW a las 6:30 p.m., concentrándose en la zona centro-oriental. Hoy, a las 6:05 a.m., se reportaron nuevas afectaciones por altas transferencias hacia esa región. A las 7:00 a.m., la disponibilidad del SEN es de 1,790 MW, frente a una demanda de 2,000 MW, con 278 MW afectados en el centro-oriente. Incidencias principales: Averías: Unidad 2 de la CTE Felton. Mantenimiento: Unidades en Santa Cruz, Cienfuegos y Renté. Limitaciones térmicas: 400 MW fuera de servicio. Centrales fuera por combustible: 479 MW. Pronóstico: Para el horario pico, se espera una disponibilidad de 1,909 MW y una demanda máxima de 3,250 MW, lo que implicaría una afectación de 1,411 MW. (Con información de UNE-MINEM )","Apagón, Apagones, Economía, Electricidad, Gobierno, Ministerio de Energía y Minas (MINEM), Sistema Eléctrico Nacional (SEN), Sociedad, Unión Eléctrica (UNE)",14,http://www.cubadebate.cu/noticias/2025/01/27/union-electrica-estima-afectacion-de-1411-mw-para-el-pico-nocturno-de-este-lunes/
UNE pronostica afectación de 1 104 MW durante pico nocturno de este domingo,2025-01-26 10:40:00,"La central termoeléctrica Lidio Ramón (Felton). Foto: Juan Pablo Carreras Vidal/ ACN/ Archivo. La Unión Eléctrica estima para el pico nocturno de este domingo una disponibilidad de 1 966 MW frente a una demanda máxima de 3 000 MW, lo que implicaría una afectación de 1 104 MW. A las 6:51 a.m. comenzaron nuevas afectaciones por altas transferencias hacia la región centro-oriental. A las 7 a.m., la disponibilidad del SEN fue de 1 881 MW, frente a una demanda de 1 758 MW, con 100 MW afectados en la zona centro-oriental. Presentan averías la unidad 2 de la CTE Felton y la unidad 1 de la CTE Santa Cruz. Están en mantenimiento unidades en Santa Cruz, Cienfuegos y Renté. Las limitaciones térmicas son de 366 MW. Las afectaciones por centrales fuera por combustible ascienden a 302 MW. Ayer, el servicio eléctrico presentó afectaciones desde las 6:40 a.m. hasta las 10:42 p.m., alcanzando una máxima afectación de 1 245 MW a las 6:20 p.m., con mayor impacto en la zona centro-oriental.","Economía, Electricidad, Empresa Eléctrica, Generación Eléctrica, Gobierno, Ministerio de Energía y Minas (MINEM), Sistema Eléctrico Nacional (SEN), Termoeléctrica, Unión Eléctrica (UNE)",10,http://www.cubadebate.cu/noticias/2025/01/26/une-pronostica-afectacion-de-1-104-mw-durante-pico-nocturno-de-este-domingo/
La Unión Eléctrica pronostica una afectación de 1 060 MW para el horario pico nocturno,2025-01-25 09:59:00,"La Unión Eléctrica estima para la hora pico nocturna una disponibilidad de 2 010 MW y una demanda máxima de 3 000 MW, para un déficit de 990 MW, por lo que, de mantenerse las condiciones, previstas se pronostica una afectación de 1 060 MW en este horario. A las 06:40 de la mañana de hoy se comenzó a afectar el servicio por altas transferencias hacia la zona centro oriental. La disponibilidad del SEN a las 07:00 horas era de 2 010 MW y la demanda de 1 700 MW, con 90 MW afectados en la zona centro oriental por alta transferencia. En el horario de la media se estima una afectación de 580 MW, con mayor incidencia en la zona centro oriental. Presenta avería la unidad 2 de la CTE Felton, mientras se encuentran en mantenimiento la unidad 2 de la CTE Santa Cruz, las unidades 3 y 4 de la CTE Cienfuegos y la unidad 5 de la CTE Renté. Las limitaciones en la generación térmica son de 392 MW. Están fuera de servicio por déficit de combustible 37 centrales de generación distribuida con 152 MW, y 126 MW en la central fuel de Moa, para un total de 278 MW afectados por esta causa. En el día de ayer se afectó el servicio desde las 06:48 horas hasta las 20:50. La máxima afectación fue de 960 MW a las 18:30 horas, coincidente con la hora de máxima demanda, con mayor incidencia en la zona centro oriental.","Apagones, Cuba, Economía, Electricidad, Gobierno, Ministerio de Energía y Minas (MINEM), Sistema Eléctrico Nacional (SEN), Unión Eléctrica (UNE)",13,http://www.cubadebate.cu/noticias/2025/01/25/la-union-electrica-pronostica-una-afectacion-de-1-060-mw-para-el-horario-pico-nocturno/
Unión Eléctrica: Déficit de 1 020 MW en horario pico nocturno de este viernes y 480 MW al mediodía,2025-01-24 10:20:00,"Foto: Archivo de Cubadebate La Unión Eléctrica estimó un déficit de 1 020 MW en horario pico nocturno y 480 MW al mediodía, de acuerdo con el parte habitual emitido por la empresa. Según el reporte, el servicio eléctrico fue afectado desde las 06:46 a.m., hasta las 09:51 p.m., con una afectación máxima de 1 039 MW registrada a las 06:20 p.m., coincidiendo con la hora de máxima demanda y con un mayor impacto en la zona centro-oriental. Sin embargo, a las 06:46 a.m. de hoy se comenzó a afectar nuevamente el servicio debido a altas transferencias hacia la zona centro-oriental. Hoy, a las 06:48 a.m., se reportaron nuevas afectaciones debido a altas transferencias hacia dicha región. Estado actual del SEN A las 7:00 a.m., la disponibilidad del SEN era de 2100 MW, frente a una demanda de 1 880 MW, con 50 MW afectados en la zona centro-oriental por alta transferencia. Para el mediodía, se estima la afectación de 480 MW, también concentrados en esta región. Principales incidencias: Averías: Unidad 2 de la CTE Felton. Mantenimiento: Unidad 2 de la CTE Santa Cruz, Unidades 3 y 4 de la CTE Cienfuegos y Unidad 5 de la CTE Renté. Limitaciones térmicas: 386 MW fuera de servicio. Problemas por falta de combustible: 39 centrales de generación distribuida (178 MW). Pronóstico para el horario pico Se espera una disponibilidad de 2 100 MW frente a una demanda máxima de 3 050 MW, lo que implicaría un déficit de 950 MW. En consecuencia, se pronostica una afectación de 1 020 MW en el horario pico, de mantenerse las condiciones actuales. (Con información de la UNE)","Apagones, Combustibles, Cuba, Economía, Electricidad, Gobierno, Ministerio de Energía y Minas (MINEM), Unión Eléctrica (UNE)",1,http://www.cubadebate.cu/noticias/2025/01/24/union-electrica-deficit-de-1-020-mw-en-horario-pico-nocturno-de-este-viernes-y-480-mw-al-mediodia/
La Unión Eléctrica pronostica una afectación de 990 MW para el horario pico de este jueves,2025-01-23 09:09:00,"Foto: Archivo/Cubadebate. La Unión Eléctrica informa que, en el día de ayer, el servicio eléctrico fue restablecido a las 9:35 p.m. después de una afectación máxima de 981 MW a las 6:10 p.m., coincidiendo con la hora de mayor demanda. Este jueves, a las 6:46 a.m., se reportaron nuevas afectaciones debido a altas transferencias hacia la zona centro-oriental. A las 7:00 a.m., la disponibilidad del SEN era de 2 120 MW, frente a una demanda de 2 015 MW, con 75 MW afectados. Entre las principales incidencias, la UNE señaló que tiene averías la Unidad 2 de la CTE Felton y que se encuentran en mantenimiento las Unidades en Santa Cruz, Cienfuegos y Renté. Las limitaciones térmicas se calculan en 423 MW, que están fuera de servicio. 37 centrales (132 MW) están fuera por falta de combustible. Ante ese escenario, para el horario pico, se estima una disponibilidad de 2120 MW y una demanda máxima de 3 040 MW, lo que implicaría una afectación de 990 MW. (Con información de la UNE)","Apagones, Combustibles, Cuba, Economía, Electricidad, Gobierno, Ministerio de Energía y Minas (MINEM), Unión Eléctrica (UNE)",3,http://www.cubadebate.cu/noticias/2025/01/23/la-union-electrica-pronostica-una-afectacion-de-990-mw-para-el-horario-pico-de-este-jueves/
UNE pronostica afectación de 1 270 MW durante pico nocturno de este miércoles,2025-01-22 09:30:00,"Termoeléctrica Felton. Foto: Archivo. El servicio eléctrico estuvo afectado durante las 24 horas del 21 de enero y se mantuvo en la madrugada de hoy. La máxima afectación fue de 1 676 MW a las 6:50 p.m., coincidiendo con la hora de máxima demanda. Esto se debió a la no entrada de la unidad 6 de la CTE Nuevitas antes del horario pico. Estado actual del Sistema Eléctrico Nacional Disponibilidad a las 7:00 a.m.: 1 830 MW. Demanda actual: 2 315 MW. Afectación actual por déficit: 559 MW. Pronóstico al mediodía: Afectación estimada de 850 MW. Principales incidencias Averías: Unidad 2 de la CTE Felton. Mantenimiento: Unidad 2 de la CTE Santa Cruz. Unidad de la CTE Guiteras. Unidades 3 y 4 de la CTE Cienfuegos. Unidad 5 de la CTE Renté. Limitaciones térmicas: 363 MW fuera de servicio. Falta de combustible: 41 centrales de generación distribuida con un total de 208 MW. Para el horario pico se espera la entrada de la Unidad de la CTE Guiteras con 250 MW (en proceso de arranque). Con esta adición, se estima una disponibilidad de 2 080 MW frente a una demanda máxima de 3 280 MW. Esto resultará en un déficit de 1 200 MW y una afectación prevista de hasta 1 270 MW en el horario pico. (Con información de la Unión Eléctrica)","Cuba, Economía, Electricidad, Empresa Eléctrica, Generación Eléctrica, Gobierno, Ministerio de Energía y Minas (MINEM), Sistema Eléctrico Nacional (SEN), Termoeléctrica, Unión Eléctrica (UNE)",+,http://www.cubadebate.cu/noticias/2025/01/22/une-pronostica-afectacion-de-1-270-mw-durante-pico-nocturno-de-este-miercoles/
UNE pronostica afectación de 1 600 MW durante hora pico de este martes,2025-01-21 10:21:00,"La central termoeléctrica Lidio Ramón (Felton). Foto: Juan Pablo Carreras Vidal/ ACN/ Archivo. La Unión Eléctrica estima para la hora pico de este martes una disponibilidad estimada de 1 720 MW, mientras que la demanda máxima podría alcanzar 3 250 MW, resultando en un déficit de 1 530 MW, y una afectación de 1 600 MW durante ese horario. Para el horario pico se espera la entrada de la unidad 3 de la CTE Rente (60 MW, en proceso de arranque) y la unidad 6 de la CTE Nuevitas (100 MW). A las 7 a.m., la disponibilidad del SEN fue de 1 560 MW, mientras que la demanda ascendió a 2 285 MW, con 783 MW afectados por déficit de generación. Para el mediodía, se prevé una afectación de 1 200 MW. Presentan averías la unidad 8 de la CTE Mariel, la unidad 6 de la CTE Nuevitas, la unidad 3 de la CTE Renté y la unidad 2 de la CTE Felton. Están en mantenimiento la unidad 2 de la CTE Santa Cruz, la unidad de la CTE Guiteras, las unidades 3 y 4 de la CTE Cienfuegos, y la unidad 5 de la CTE Renté. Las limitaciones térmicas son de 255 MW. Presentan problemas por falta de combustible 49 centrales de generación distribuida (285 MW). El lunes, el servicio eléctrico se mantuvo afectado desde las 00:00 a.m., extendiéndose durante toda la madrugada de este martes. La máxima afectación alcanzó los 1 708 MW a las 6:20 p.m., coincidiendo con la hora de mayor demanda. Este nivel de afectación se debió a la no entrada a tiempo de la unidad 5 de la CTE Mariel antes del horario pico.","Cuba, Economía, Electricidad, Empresa Eléctrica, Generación Eléctrica, Gobierno, Ministerio de Energía y Minas (MINEM), Sistema Eléctrico Nacional (SEN), Termoeléctrica, Unión Eléctrica (UNE)",19,http://www.cubadebate.cu/noticias/2025/01/21/une-pronostica-afectacion-de-1-600-mw-durante-hora-pico-de-este-martes/
