Título,Fecha,Contenido,Etiquetas,Número de Comentarios,Enlace
La Unión Eléctrica pronostica una afectación de 1 300 MW para el horario pico nocturno,2025-03-09 09:55:00,"La Unión Eléctrica estima para el horario pico nocturno una disponibilidad de 1 820 MW y una demanda máxima de 3 050 MW, para un déficit de 1 230 MW, por lo que, de mantenerse las condiciones previstas, se pronostica una afectación de 1 300 MW en el país. La disponibilidad del SEN a las 07:00 horas fue de 1 840 MW y la demanda de 1 930 MW, con 90 MW afectados. En el horario de la media se estima una afectación de 850 MW, con mayor incidencia en la zona centro oriental. En la jornada de ayer se afectó el servicio desde las 00:00 horas hasta las 02:20 y desde las 05:16 hasta las 24:00, por déficit de capacidad de generación. Se restableció a las 03:14 de la madrugada de hoy y se comenzó a afectar nuevamente a las 06:18 por déficit de generación. La máxima afectación fue de 1 401 MW a las 18:50, no coincidente con la hora de máxima demanda. Presentan averías la unidad 5 de la CTE Nuevitas y las unidades 1 y 2 de la CTE Felton. Se encuentran en mantenimiento la unidad 6 de la CTE Mariel, la unidad 2 de la CTE Santa Cruz, las unidades 3 y 4 de la CTE Cienfuegos y la unidad 5 de la CTE Renté. Las limitaciones en la generación térmica son de 343 MW, y se encuentran fuera de servicio por déficit de combustible 43 centrales de generación distribuida, con 261 MW.","Apagones, Cuba, Economía, Electricidad, Gobierno, Ministerio de Energía y Minas (MINEM), Sistema Eléctrico Nacional (SEN), Unión Eléctrica (UNE)",4,http://www.cubadebate.cu/noticias/2025/03/09/la-union-electrica-pronostica-una-afectacion-de-1-300-mw-para-el-horario-pico-nocturno/
UNE prevé afectación de 1 390 MW en horario pico este viernes,2025-03-07 09:12:00,"Foto: Archivo. A las 7 a.m. de este viernes, la disponibilidad del SEN era de 1 580 MW y la demanda, de 2185 MW, lo que provoca una afectación de 672 MW. Para el mediodía, se estima una afectación de 1 050 MW, informa la Unión Eléctrica en su habitual parte diario. Este jueves el servicio estuvo afectado las 24 horas del día por déficit de capacidad, situación que se mantuvo durante la madrugada de este viernes. La máxima afectación fue de 1 624 MW a las 6:30 p.m., no coincidente con la hora de máxima demanda y superior a lo planificado por salida imprevista de la unidad 1 de la CTE Santa Cruz y la no entrada de los motores de Moa, como estaba previsto. Entre las incidencias de la jornada de este viernes, la UNE señala que están fuera por averías la unidad 5 de la CTE Nuevitas y la unidad 2 de la CTE Felton; en mantenimiento, la unidad 6 de la CTE Mariel, la unidad 2 de la CTE Santa Cruz, las unidades 3 y 4 de la CTE de Cienfuegos y la unidad 5 de la CTE Renté. Se reportan 403 MW fuera de servicio por limitaciones térmicas. Por falta de combustible no están generando 83 centrales de generación distribuida (512 MW), siete motores de la patana de Melones (123 MW) y la central de Moa (147 MW), para un total de 782 MW afectados por esta causa. Para el horario pico se estima la recuperación de 80 MW en motores de la generación distribuida que están fuera por falta de combustible, y la entrada de siete motores en la patana de Melones y 10 motores en la central fuel de Moa, con 147 MW. Con este pronóstico, se estima para el pico una disponibilidad de 1 930 MW y una demanda máxima de 3 250 MW, para un déficit de 1 320 MW, por lo que de mantenerse las condiciones previstas se pronostica una afectación de 1 390 MW en ese horario.","Cuba, Economía, Electricidad, Energía, Gobierno, Ministerio de Energía y Minas (MINEM), Termoeléctrica, Unión Eléctrica (UNE)",16,http://www.cubadebate.cu/noticias/2025/03/07/une-preve-afectacion-de-1-390-mw-en-horario-pico-este-viernes/
La UNE prevé una afectación de 1344 MW para el horario pico de este jueves,2025-03-06 08:59:00,"La Unión Eléctrica informa que este miércoles se afectó el servicio las 24 horas del día por déficit de capacidad de generación, y este se mantuvo afectado durante toda la madrugada de hoy. La máxima afectación fue de 1689 MW a las 19:30 horas, coincidente con la hora de máxima demanda. Agregó que a las 7:00 a.m. de este jueves, la disponibilidad del SEN era de 1630 MW, mientras que la demanda alcanza los 2480 MW, lo que provoca una afectación de 872 MW. Para el mediodía, se estima una afectación de 1100 MW. Entre las principales incidencias, la UNE señaló que están en avería la Unidad 5 de la CTE Nuevitas y Unidad 2 de la CTE Felton. Se encuentran en mantenimiento la Unidad 6 de la CTE Mariel, la Unidad 2 de la CTE Santa Cruz, las Unidades 3 y 4 de la CTE Cienfuegos y la Unidad 5 de la CTE Renté. Existen limitaciones térmicas, con 385 MW fuera de servicio. Por problemas con el suministro de combustible, se reportan problemas en 82 centrales de generación distribuida (501 MW), la central fuel de Mariel (116 MW), la central fuel de Moa (147 MW); para un total de 764 MW afectados por esta causa. La UNE pronostica para el horario pico la recuperación de 100 MW en motores de la generación distribuida que se encuentran fuera por falta de combustible, y la entrada de 5 motores en la central fuel de Moa, con 80 MW, así como la entrada de 7 motores en la central fuel de Mariel, con 116 MW. Con este pronóstico, se estima para el pico una disponibilidad de 1926 MW y una demanda máxima de 3200 MW, para un déficit de 1274 MW, por lo que, de mantenerse las condiciones previstas, se espera una afectación de 1344 MW en este horario.","Apagones, Combustibles, Economía, Electricidad, Energía, Gobierno, Ministerio de Energía y Minas (MINEM), Unión Eléctrica (UNE)",11,http://www.cubadebate.cu/noticias/2025/03/06/la-une-preve-una-afectacion-de-1344-mw-para-el-horario-pico-de-este-jueves/
UNE pronostica una afectación de 1 726 MW para pico nocturno de este miércoles,2025-03-05 09:06:00,"Foto: ACN. A las 7:00 a.m., la disponibilidad del SEN es de 1315 MW, mientras que la demanda alcanza los 2380 MW, lo que provoca una afectación de 1099 MW. Para el mediodía, se estima una afectación de 1450 MW. Principales incidencias Avería: Unidad 5 de la CTE Nuevitas y Unidad 2 de la CTE Felton. Mantenimiento: Unidad 6 de la CTE Mariel, Unidad 2 de la CTE Santa Cruz, Unidades 3 y 4 de la CTE Cienfuegos y Unidad 5 de la CTE Renté. Limitaciones térmicas: 375 MW fuera de servicio. Problemas por falta de combustible: 85 centrales de generación distribuida (514 MW). Central fuel de Mariel (116 MW) Central fuel de Moa (147 MW) Patana de Regla (54 MW) 8 motores en la Patana de Melones (135 MW) Total: 966 MW afectados por esta causa. Para el pico se estima la recuperación de 120 MW en motores de la generación distribuida que se encuentran fuera por combustible, y la entrada de 8 motores en la patana de Melones con, 135 MW, y la patana de Regla, con 54 MW. Con este pronóstico, se estima para el pico una disponibilidad de 1624 MW y una demanda máxima de 3280 MW, para un déficit de 1656, por lo que de mantenerse las condiciones previstas se pronostica una afectación de 1726 MW en este horario. (Con información de la UNE)","Cuba, Economía, Electricidad, Gobierno, Ministerio de Energía y Minas (MINEM), Sistema Eléctrico Nacional (SEN), Termoeléctrica, Unión Eléctrica (UNE)",43,http://www.cubadebate.cu/noticias/2025/03/05/une-pronostica-una-afectacion-de-1-726-mw-para-pico-nocturno-de-este-miercoles/
La Unión Eléctrica pronostica una afectación de 1 597 MW para el horario pico nocturno,2025-03-03 08:53:00,"La Unión Eléctrica estima para la hora pico nocturna una disponibilidad de 1 723 MW y una demanda máxima de 3 250 MW, para un déficit de 1 527, por lo que, de mantenerse las condiciones previstas, se pronostica una afectación de 1 597 MW en este horario. También para ese horario se estima la recuperación de 50 MW en motores de la generación distribuida que se encuentran fuera por déficit de combustible, y la entrada de cuatro motores de la Patana de Melones, con 68 MW. A las 7:00 a.m., la disponibilidad del SEN era de 1 605 MW, mientras la demanda alcanzaba los 2 250 MW, lo cual provoca una afectación de 669 MW. Para el mediodía, se estima una afectación de 950 MW. Entre las principales incidencias, la Unión Eléctrica mencionó una avería en la CTE Felton y el mantenimiento de la unidad 6 de la CTE Mariel, la unidad 2 de la CTE Santa Cruz, las unidades 3 y 4 de la CTE Cienfuegos y la unidad 5 de la Renté. Hay 438 MW indisponibles por limitaciones térmicas. Por déficit de combustibles están fuera de servicio 86 centrales de generación distribuida (574 MW), nueve motores en el Emplazamiento de Moa (129 MW), cinco motores en la Patana de Regla (45 MW), y cuatro motores en la Patana de Melones (68 MW), para un total de 816 MW afectados por esta causa. En la jornada de ayer se afectó el servicio por déficit de capacidad desde las 5:19 a.m. y se mantuvo afectado durante toda la madrugada de hoy. La máxima afectación fue de 1 562 MW a las 19:10 horas, coincidente con la hora de máxima demanda, y superior a lo planificado porque no entraron los motores de la Patana de Melones.","Cuba, Economía, Electricidad, Gobierno, Ministerio de Energía y Minas (MINEM), Sistema Eléctrico Nacional (SEN), Termoeléctrica, Unión Eléctrica (UNE)",17,http://www.cubadebate.cu/noticias/2025/03/03/la-union-electrica-pronostica-una-afectacion-de-1-597-mw-para-el-horario-pico-nocturno/
Unión Eléctrica prevé un déficit de 1312 MW para pico nocturno de este domingo,2025-03-02 10:23:00,"Foto: Archivo. En el día de ayer se afectó el servicio por déficit de capacidad desde las 05:24 horas y se restableció en la madrugada de hoy a las 02:34 horas. La máxima afectación fue de 1456 MW a las 19:10 horas, no coincidente con la hora de máxima demanda. Estado actual del SEN A las 7:00 a.m., la disponibilidad del SEN es de 1750, mientras que la demanda alcanza los 2130, lo que provoca una afectación de 450 MW. Para el mediodía, se estima una afectación de 800 MW. Principales incidencias Mantenimiento: Unidad 2 de la CTE Santa Cruz, Unidades 3 y 4 de la CTE Cienfuegos y Unidad 5 de la CTE Renté. Limitaciones térmicas: 501 MW fuera de servicio. Problemas por falta de combustible: 80 centrales de generación distribuida (507 MW). 10 motores de la Patana de Melones (165 MW). Total: 672 MW afectados por esta causa. Pronóstico para el horario pico: Para el pico se estima la recuperación de 50 MW en motores de la generación distribuida que se encuentran fuera por combustible, la salida de 4 motores de Moa por combustible con 57 MW y la entrada de 10 motores de la Patana de Melones con 165 MW. Con este pronóstico, se estima para el pico una disponibilidad de 1908 MW y una demanda máxima de 3150 MW, para un déficit de 1242 MW, por lo que de mantenerse las condiciones previstas se pronostica una afectación de 1312 MW en este horario. (Tomado de la UNE-MINEM)","Apagones, Cuba, Economía, Electricidad, Generación Eléctrica, Gobierno, Ministerio de Energía y Minas (MINEM), Sistema Eléctrico Nacional (SEN), Termoeléctrica, Unión Eléctrica (UNE)",6,http://www.cubadebate.cu/noticias/2025/03/02/union-electrica-preve-un-deficit-de-1312-mw-para-pico-nocturno-de-este-domingo/
La Unión Eléctrica pronostica una afectación de 1 575 MW para el horario pico nocturno,2025-03-01 09:07:00,"La Unión Eléctrica pronostica para el horario pico nocturno una disponibilidad de 1 745 MW y una demanda máxima de 3 250 MW, lo cual generaría un déficit de 1 505 MW. De mantenerse estas condiciones, la afectación podría alcanzar los 1 575 MW, con mayor incidencia en la zona centro-oriental. Para ese horario se espera la recuperación de 50 MW en motores de generación distribuida, que se encuentran fuera de servicio por déficit de combustible; así como la entrada de la turbina 5 de Energas Jaruco, con 30 MW; y el completamiento de la Unidad 6 de esta misma central, con 15 MW más. Además, se pronostica la salida de 6 motores en la central de Moa por déficit de combustible (90 MW). A las 7:00 am la disponibilidad del SEN era de 1 740 MW, mientras que la demanda alcanzaba los 2 130, lo cual provocó una afectación de 400 MW. Para el mediodía, se estima una afectación de 900 MW, con mayor incidencia en la zona centro-oriental. Entre las principales incidencias están las averías en la Unidad 5 de la CTE Mariel, la Unidad 5 de la CTE Nuevitas y la Unidad 2 de la CTE Felton. Se encuentran en mantenimiento la Unidad 2 de la CTE Santa Cruz, las Unidades 3 y 4 de la CTE Cienfuegos y la Unidad 5 de la CTE Renté. Hay 419 MW fuera de servicio por limitaciones térmicas. Mientras, existen problemas por déficit de combustible en 77 centrales de generación distribuida (489 MW) y 4 motores en la central fuel de Moa (60 MW), para un total de 549 MW afectados por esta causa. En la jornada de ayer el servicio tuvo problemas por déficit de capacidad de generación las 24 horas del día, se restableció a las 3:36 horas de la madrugada de hoy y se comenzó a afectar nuevamente a las 5:24 a.m, por altas transferencias hacia la zona centro-oriental. La máxima afectación registrada fue de 1 736 MW a las 7:10 p.m., coincidente con la hora de máxima demanda, superior a lo planificado porque no entraron la Unidad 1 de Santa Cruz y la turbina 5 de Energás Jaruco.","Apagones, Economía, Electricidad, Gobierno, Ministerio de Energía y Minas (MINEM), Sistema Eléctrico Nacional (SEN), Termoeléctrica, Unión Eléctrica (UNE)",8,http://www.cubadebate.cu/noticias/2025/03/01/la-union-electrica-pronostica-una-afectacion-de-1-575-mw-para-el-horario-pico-nocturno/
Unión Eléctrica pronostica afectación de 1550 MW,2025-02-27 09:42:00,"Foto: Archivo. La Unión Eléctrica estima para este jueves una disponibilidad de 1 720 MW y una demanda máxima de 3 200 MW, lo que generaría un déficit de 1480 MW . De mantenerse estas condiciones, la afectación podría alcanzar los 1 550 MW , con mayor incidencia en la zona centro-oriental. En el día de ayer se afectó el servicio por déficit de capacidad las 24 horas del día, manteniéndose así durante la madrugada de este jueves. La máxima afectación registrada fue de 1 680 MW a las 7:40 p.m., no coincidente con la hora de máxima demanda. A las 7:00 a.m., la disponibilidad del SEN es de 1 540 MW, mientras que la demanda alcanza los 2 220 MW, lo que provocó una afectación de 702 MW, con mayor incidencia en la zona centro-oriental. Para el mediodía, se estima una afectación de 1 100 MW, con mayor incidencia en la zona centro-oriental. Principales incidencias: Averías: Unidad 5 de la CTE Mariel, Unidad 3 de la CTE Santa Cruz, Unidad 3 de la CTE Renté y Unidades 1 y 2 de la CTE Felton. Mantenimiento: Unidad 2 de la CTE Santa Cruz, Unidades 3 y 4 de la CTE Cienfuegos y Unidad 5 de la CTE Renté. Limitaciones térmicas: 367 MW fuera de servicio. Problemas por falta de combustible: 71 centrales de generación distribuida (503 MW). 5 motores en la central fuel de Moa (70 MW). 54 MW en la Patana de Regla Total: 573 MW afectados por esta causa. Se espera la recuperación de 50 MW en motores de generación distribuida que se encuentran fuera por combustible; y la entrada de la Unidad 3 de la CTE Santa Cruz con 60 MW, y la entrada de 5 motores de la central fuel de Moa, con 70 MW. (Con información de UNE-MINEM)","Apagones, Economía, Electricidad, Gobierno, Ministerio de Energía y Minas (MINEM), Unión Eléctrica (UNE)",7,http://www.cubadebate.cu/noticias/2025/02/27/union-electrica-pronostica-afectacion-de-1550-mw/
Unión Eléctrica pronostica afectación de 1 641 MW en pico nocturno de este miércoles,2025-02-26 09:40:00,"Termoeléctrica 10 de Octubre, en el municipio de Nuevitas, en Camagüey, el 25 de febrero de 2023. Foto: ACN En el día de ayer se afectó el servicio por déficit de capacidad las 24 horas del día, manteniéndose así durante la madrugada de hoy. La máxima afectación registrada fue de 1 748 MW a las 7:10 p.m., coincidente con la hora de máxima demanda, mayor de lo planificado por demanda superior a lo previsto. A las 7:00 a.m. la disponibilidad del SEN era de 1 610 MW, mientras que la demanda alcanza los 2 220 MW, lo que provocó una afectación de 667 MW, con mayor incidencia en la zona centro-oriental. Para el mediodía, se estima una afectación de 1 100 MW, con mayor incidencia en la zona centro-oriental. Principales incidencias: Averías: Unidad 3 de la CTE Santa Cruz, Unidad 3 de la CTE Renté y Unidades 1 y 2 de la CTE Felton. Mantenimiento: Unidad 2 de la CTE Santa Cruz, Unidades 3 y 4 de la CTE Cienfuegos y Unidad 5 de la CTE Renté. Limitaciones térmicas: 360 MW fuera de servicio. Problemas por falta de combustible: 76 centrales de generación distribuida (566 MW); 68 MW en la central fuel de Mariel; 54 MW en la Patana de Regla, para un total de 658 MW afectados por esta causa. Se espera la recuperación de 80 MW en motores de generación distribuida que se encuentran fuera por combustible; y la entrada de la Unidad 3 de la CTE Renté con 65 MW. Con este pronóstico, se estima una disponibilidad de 1 629 MW y una demanda máxima de 3 200 MW, lo que generaría un déficit de 1 571 MW. De mantenerse estas condiciones, la afectación podría alcanzar los 1 641 MW, con mayor incidencia en la zona centro-oriental. (Con información de la UNE)","Apagones, Combustibles, Cuba, Economía, Electricidad, Gobierno, Ministerio de Energía y Minas (MINEM), Sistema Eléctrico Nacional (SEN), Unión Eléctrica (UNE)",28,http://www.cubadebate.cu/noticias/2025/02/26/union-electrica-pronostica-afectacion-de-1-641-mw-en-pico-nocturno-de-este-miercoles/
Unión Eléctrica estima déficit de 1592 MW para la jornada de este martes,2025-02-25 09:54:00,"Termoeléctrica Felton. Foto: Archivo. La Unión Eléctrica informa que en el día de ayer se afectó el servicio por déficit de capacidad las 24 horas del  día, manteniéndose así durante la madrugada de hoy. La máxima afectación registrada fue de 1,713 MW a las 7:50 p.m., coincidente con la hora de máxima demanda. Estado actual del SEN A las 7:00 a.m., la disponibilidad del SEN es de 1,360 MW, mientras que la demanda alcanza los 2,320 MW, lo que provoca una afectación de 1,450 MW, con mayor incidencia en la zona centro-oriental. Para el mediodía, se estima una afectación de 1,450 MW, con mayor incidencia en la zona centro-oriental. Principales incidencias: Averías: Unidad 3 de la CTE Santa Cruz, Unidad 3 de la CTE Renté y Unidades 1 y 2 de la CTE Felton. Mantenimiento: Unidad 2 de la CTE Santa Cruz, Unidades 3 y 4 de la CTE Cienfuegos y Unidad 5 de la CTE Renté. Limitaciones térmicas: 392 MW fuera de servicio. Problemas por falta de combustible: 83 centrales de generación distribuida (422 MW). 68 MW en la central fuel de Mariel 54 MW en la Patana de Regla Total: 658 MW afectados por esta causa. Pronóstico para el horario pico Se espera la recuperación de 80 MW en motores de generación distribuida que se encuentran fuera por combustible; y el completamiento de la Unidad 6 de la CTE Nuevitas con 50 MW. Además se espera la entrada de 5 motores del fuel de Mariel, con 68 MW. Con este pronóstico, se estima una disponibilidad de 1,558 MW y una demanda máxima de 3,080 MW, lo que generaría un déficit de 1,522 MW. De mantenerse estas condiciones, la afectación podría alcanzar los 1,592 MW, con mayor incidencia en la zona centro-oriental. (Con información de UNE-MINEM)","Apagón, Apagones, Economía, Electricidad, Empresa Eléctrica, Gobierno, Ministerio de Energía y Minas (MINEM), Sistema Eléctrico Nacional (SEN), Sociedad, Unión Eléctrica (UNE)",10,http://www.cubadebate.cu/noticias/2025/02/25/union-electrica-estima-deficit-de-1450-mw-para-la-jornada-de-hoy/
Unión Eléctrica estima déficit de 1736 MW durante el pico nocturno de este lunes,2025-02-24 08:51:00,"La máxima afectación registrada fue de 1,572 MW a las 7:20 p.m. Foto: Archivo. En el día de ayer se afectó el servicio por déficit de capacidad las 24 horas del día, manteniéndose así durante la madrugada de hoy. La máxima afectación registrada fue de 1,572 MW a las 7:20 p.m., coincidente con la hora de máxima demanda. Estado actual del SEN A las 7:00 a.m., la disponibilidad del SEN es de 1,384 MW, mientras que la demanda alcanza los 2,360 MW, lo que provoca una afectación de 966 MW. Para el mediodía, se estima una afectación de 1,350 MW, con mayor incidencia en la zona centro-oriental. Principales incidencias: Averías: Unidad 3 de la CTE Santa Cruz, Unidad 3 de la CTE Renté y Unidades 1 y 2 de la CTE Felton. Mantenimiento: Unidad 2 de la CTE Santa Cruz, Unidades 3 y 4 de la CTE Cienfuegos y Unidad 5 de la CTE Renté. Limitaciones térmicas: 392 MW fuera de servicio. Problemas por falta de combustible: 83 centrales de generación distribuida (582 MW). 102 MW en la central fuel de Mariel 54 MW en la Patana de Regla Total: 729 MW afectados por esta causa. Pronóstico para el horario pico Se espera la recuperación de 100 MW en motores de generación distribuida que se encuentran fuera por combustible. Con este pronóstico, se estima una disponibilidad de 1,484 MW y una demanda máxima de 3,150 MW, lo que generaría un déficit de 1,666 MW. De mantenerse estas condiciones, la afectación podría alcanzar los 1,736 MW, con mayor incidencia en la zona centro-oriental. (Con información de UNE-MINEM )","Apagón, Apagones, Economía, Electricidad, Empresa Eléctrica, Gobierno, Ministerio de Energía y Minas (MINEM), Sistema Eléctrico Nacional (SEN), Sociedad, Unión Eléctrica (UNE)",25,http://www.cubadebate.cu/noticias/2025/02/24/union-electrica-estima-deficit-de-1736-mw-durante-el-pico-nocturno-de-este-lunes/
La Unión Eléctrica estima una afectación de 1630 MW en el horario pico de este domingo,2025-02-23 11:33:00,"Foto: Archivo/Cubadebate. La Unión Eléctrica informó que este sábado se afectó el servicio por déficit de capacidad las 24 horas del día. El servicio también se mantuvo afectado durante toda la madrugada de hoy. La máxima afectación fue de 1642 MW a las 18:40 horas, no coincidente con la hora de máxima demanda y superior a lo planificado por no entrar los motores de la móvil de Regla y la unidad 6 de la CTE Renté. La disponibilidad del SEN a las 07:00 horas de este domingo era de 1330 MW y la demanda 2300 MW con 800 MW afectados. En el horario de la media se estima una afectación de 1400 MW, con mayor incidencia en la zona centro oriental. Se encuentran en avería la unidad 3 de la CTE Santa Cruz, las unidades 5 y 6 de la CTE Nuevitas (unidad 5 en proceso de arranque), las unidades 1 y 2 de la CTE Felton, las unidades 3 y 6 de la CTE Renté (unidad 6 en proceso de arranque). En mantenimiento se encuentra la unidad 2 de la CTE Santa Cruz, las unidades 3 y 4 de la CTE Cienfuegos y la unidad 5 de la CTE Renté. Las limitaciones en la generación térmica son de 250  MW. Se encuentran fuera de servicio por combustible 83 centrales de generación distribuida con 452 MW, 68 MW en la central fuel de Mariel, para un total de 520 MW afectados por esta causa. Para el pico se estima la entrada de la unidad 5 y 6 de la CTE Nuevitas con 120 MW, la entrada de la unidad 6 de la CTE Renté con 60 MW y la recuperación de 80 MW en motores de la generación distribuida que se encuentran fuera por combustible. Con este pronóstico, se estima para el pico una disponibilidad de 1590 MW y una demanda máxima de 3150 MW, para un déficit de 1560 MW , por lo que de mantenerse las condiciones previstas se pronostica una afectación de 1630 MW en este horario.","Apagones, Combustibles, Cuba, Economía, Electricidad, Gobierno, Ministerio de Energía y Minas (MINEM), Sistema Eléctrico Nacional (SEN), Unión Eléctrica (UNE)",9,http://www.cubadebate.cu/noticias/2025/02/23/la-union-electrica-estima-una-afectacion-de-1630-mw-en-el-horario-pico-de-este-domingo/
Unión Eléctrica estima afectación de 1 557 MW este sábado en horario pico,2025-02-22 09:31:00,"Foto: Archivo. La Unión Eléctrica estima este sábado una disponibilidad de 1 603 MW y una demanda máxima de 3 090 MW, lo que generaría un déficit de 1 487 MW. De mantenerse estas condiciones, la afectación podría alcanzar los 1 557 MW, con mayor incidencia en la zona centro-oriental. Para el horario pico se espera la entrada de 5 motores de la Patana de Regla, con 45 MW, la entrada de la Unidad 6 de la CTE Renté, con 60 MW, y la recuperación de 80 MW en motores de generación distribuida que se encuentran fuera por combustible. A las 7:00 a.m., la disponibilidad del SEN era de 1 418 MW, mientras que la demanda alcanzaba los 2 214 MW, lo que provocó una afectación de 847 MW. Para el mediodía, se estima una afectación de 1 200 MW, con mayor incidencia en la zona centro-oriental. Este viernes se afectó el servicio por déficit de capacidad las 24 horas del día, manteniéndose así durante la madrugada de hoy. La máxima afectación registrada fue de 1 567 MW a las 7:20 p.m., coincidente con la hora de máxima demanda. Principales incidencias Averías: Unidad 6 de la CTE Renté, Unidades 5 y 6 de la CTE Nuevitas y Unidades 1 y 2 de la CTE Felton. Mantenimiento: Unidad 2 de la CTE Santa Cruz, Unidades 3 y 4 de la CTE Cienfuegos y Unidad 5 de la CTE Renté. Limitaciones térmicas: 438 MW fuera de servicio. Problemas por falta de combustible: 72 centrales de generación distribuida (398 MW). 68 MW en la central fuel de Mariel 45 MW en la Patana de Regla Total: 511 MW afectados por esta causa. (Con información de la UNE-MINEM)","Apagón, Apagones, Cuba, Economía, Electricidad, Gobierno, Ministerio de Energía y Minas (MINEM), Unión Eléctrica (UNE)",7,http://www.cubadebate.cu/noticias/2025/02/22/union-electrica-estima-afectacion-de-1-557-mw-este-sabado-en-horario-pico/
